<?xml version="1.0" encoding="UTF-8"?>
<books xmlns="http://www.uts.edu.au/31284/wsd-books"
          xmlns:xsi="http://www.w3.org/2001/XMLSchema-instance"
          xsi:schemaLocation="http://www.uts.edu.au/31284/wsd-books books.xsd">
    <book id="1">
        <title>XML Developer's Guide</title>
        <author>Matthew Gambardella</author>
        <category>Computer</category>
        <qty>1</qty>
        <price>40.0</price>
        <condition>Good</condition>
        <publication>
            <description>a computer book</description>
            <isbn>978-3-16-148410-0</isbn>
            <edition>3rd edition</edition>
            <pubYear>2014</pubYear>
            <publisher>wiley</publisher>
        </publication>
    </book>
    <book id="2">
        <title>Exercise Physiology</title>
        <author>Mcardle</author>
        <category>Health</category>
        <qty>1</qty>
        <price>35.0</price>
        <condition>fair</condition>
        <publication>
            <description>a health book</description>
            <isbn>988-1-70-146450-3</isbn>
            <edition>5th edition</edition>
            <pubYear>2015</pubYear>
            <publisher>wiley</publisher>
        </publication>
    </book>
    <book id="3">
        <title>The New Law of Torts</title>
        <author>Danuta Mendelson</author>
        <category>Legal</category>
        <qty>1</qty>
        <price>55.0</price>
        <condition>fair</condition>
        <publication>
            <description>a law book</description>
            <isbn>988-1-70-146450-3</isbn>
            <edition>7th edition</edition>
            <pubYear>2015</pubYear>
            <publisher>wiley</publisher>
        </publication>
    </book>        
</books>